<?xml version="1.0" encoding="UTF-8"?>
<users
    xmlns="http://uts/wsd/oms"
    xmlns:xsi="http://www.w3.org/2001/XMLSchema-instance"
    xsi:schemaLocation="http://uts/wsd/oms users.xsd">>
    <user>
        <firstName>Ryan</firstName>
        <lastName>Heise</lastName>
        <email>ryan@ryanheise.com</email>
        <password>blahblah</password>
        <phoneNo>12345678</phoneNo>
        <address>123 fake st</address>
        <city>sydney</city>
        <state>NSW</state>
        <postcode>2000</postcode>
    </user>
    <user>
        <firstName>Joe</firstName>
        <lastName>Bloggs</lastName>
        <email>joe@bloggs.com</email>
        <password>foobar</password>
        <phoneNo>12345678</phoneNo>
        <address>123 fake st</address>
        <city>sydney</city>
        <state>NSW</state>
        <postcode>2000</postcode>
    </user>
</users>
